asn_session,field,id_comm,last_name,first_name,id_pubb,title,year,doi
2016,10-G1,5,Guasti,Maria Teresa,6,The compositionality of logical connectives in Italian,2018,10.1007/s10936-018-9596-1
2016,10-G1,5,Guasti,Maria Teresa,7,A new case for structural intervention: evidence from Wenzhounese relative clauses,2018,10.1007/s10831-018-9182-4
2016,10-G1,5,Guasti,Maria Teresa,8,Language Acquisition. The growth of Grammar. II edition,2017,
2016,10-G1,5,Guasti,Maria Teresa,9,Semantic and Pragmatic Abilities Can Be Spared in Italian Children with SLI,2017,10.1080/15475441.2017.1308254
2016,10-G1,5,Guasti,Maria Teresa,10,Children's first handwriting productions show a rhythmic structure,2017,10.1038/s41598-017-05105-6
2016,10-G1,5,Guasti,Maria Teresa,11,Analytical Causatives,2017,
2016,10-G1,5,Guasti,Maria Teresa,12,The comprehension of Italian relative clauses in poor readers and in children with Specific Language Impairment,2017,10.5334/gjgl.107
2016,10-G1,5,Guasti,Maria Teresa,13,Which and how many questions in the acquisition of Italian,2017,
2016,10-G1,5,Guasti,Maria Teresa,14,Assessment of exergames as treatment and prevention of dysgraphia,2017,10.1007/978-3-319-46669-9_72
2016,10-G1,5,Guasti,Maria Teresa,15,"Language, reading and motor control: get rhythm!",2017,
2016,10-G1,5,Guasti,Maria Teresa,16,I disturbi specifici del linguaggio nei bambini con italiano L2,2017,
2016,10-G1,5,Guasti,Maria Teresa,17,Comparison of two types of omission in child language: Articles and third person direct object clitics,2017,10.1418/88243
2016,10-G1,5,Guasti,Maria Teresa,18,Complexity in the acquisition of Relative Clauses from School-age sequential Mandarin-Italian bilingual children,2017,
2016,10-G1,5,Guasti,Maria Teresa,19,Cross-linguistic patterns in the acquisition of quantifiers,2016,10.1073/pnas.1601341113
2016,10-G1,5,Guasti,Maria Teresa,20,The production of direct object clitics in pre-school– and primary school–aged children with specific language impairments,2016,10.3109/02699206.2016.1173100
2016,10-G1,5,Guasti,Maria Teresa,21,Morphosyntax and logical abilities in Italian poor readers: The problem of SLI under-identification,2016,10.1177/0142723716639501
2016,10-G1,5,Guasti,Maria Teresa,22,How early L2 children perform on Italian clinical markers of SLI: A study of clitic production and nonword repetition,2016,10.3109/02699206.2015.1120346
2016,10-G1,5,Guasti,Maria Teresa,23,Cross-linguistic patterns in the acquisition of quantifiers,2016,10.1073/pnas.1601341113
2016,10-G1,5,Guasti,Maria Teresa,24,The production of direct object clitics in pre-school– and primary school–aged children with specific language impairments,2016,10.3109/02699206.2016.1173100
2016,10-G1,5,Guasti,Maria Teresa,25,How do 5-year-olds understand questions? Differences in languages across Europe,2016,10.1177/0142723716640236
2016,10-G1,5,Guasti,Maria Teresa,26,A cross-linguistic study of the acquisition of clitic and pronoun production,2016,10.1080/10489223.2015.1028628
2016,10-G1,5,Guasti,Maria Teresa,27,Morphosyntax and logical abilities in Italian poor readers: The problem of SLI under-identification,2016,10.1177/0142723716639501
2016,10-G1,5,Guasti,Maria Teresa,28,Quale contributo dalla linguistica per i disturbi del linguaggio nei bambini,2016,
2016,10-G1,5,Guasti,Maria Teresa,29,First language acquisition,2016,10.1093/oxfordhb/9780199573776.013.12
2016,10-G1,5,Guasti,Maria Teresa,30,Voice alternation,2016,10.1093/oxfordhb/9780199601264.013.10
2016,10-G1,5,Guasti,Maria Teresa,31,The acquisition of Chinese relative clauses: Contrasting two theoretical approaches,2016,10.1017/S0305000914000865
2016,10-G1,5,Guasti,Maria Teresa,32,Language disorders in children with developmental dyslexia,2015,10.1075/lald.58.02gua
2016,10-G1,5,Guasti,Maria Teresa,33,The acquisition of SV order in unaccusatives: Manipulating the definiteness of the NP argument,2015,10.1017/S0305000913000536
2016,10-G1,5,Guasti,Maria Teresa,34,Developmental dyslexia with and without language impairment: ERPs reveal qualitative differences in morphosyntactic processing,2015,10.1080/87565641.2015.1072536
2016,10-G1,5,Guasti,Maria Teresa,35,Morphological cues in the comprehension of relative clauses by Greek children with specific language impairment and typical development: A comparative study,2015,10.3109/17549507.2015.1048826
2016,10-G1,5,Guasti,Maria Teresa,36,Dyslexic children fail to comply with the rhythmic constraints of handwriting,2015,10.1016/j.humov.2015.04.012
2016,10-G1,5,Guasti,Maria Teresa,37,Children's production of head-final relative clauses: The case of Mandarin,2015,10.1017/S0142716414000587
2016,10-G1,5,Guasti,Maria Teresa,38,The Acquisition of Italian: Morphosyntax and Its Interfaces in Different Modes of Acquisition,2015,
2016,10-G1,5,Guasti,Maria Teresa,39,Number dissimilarities facilitate the comprehension of relative clauses in children with (Grammatical) Specific Language Impairment,2014,10.1017/S0305000913000184
2016,10-G1,5,Guasti,Maria Teresa,40,The effect of language structure on linguistic strengths and weaknesses in children with cochlear implants: Evidence from Italian,2014,10.1017/S0142716412000562
2016,10-G1,5,Guasti,Maria Teresa,41,Combining language and space: sentence bisection in unilateral spatial neglect,2014,10.1016/j.bandl.2014.07.007
2016,10-G1,5,Guasti,Maria Teresa,42,Effects of prosodic cues on topic continuity in child language production,2014,10.1177/0142723714550111
2016,10-G1,5,Guasti,Maria Teresa,43,Failure to produce direct object clitic pronouns as a clinical marker of SLI in school-aged Italian speaking children,2014,10.3109/02699206.2013.877081
2016,10-G1,5,Guasti,Maria Teresa,44,Comparison of handwriting of Italian Dyslexic children with or without dysgraphia,2014,
2016,10-G1,5,Guasti,Maria Teresa,45,"Comorbidity between dyslexia, SLI and motor disorders",2013,
2016,10-G1,5,Guasti,Maria Teresa,46,Acquisition meets comparison: an investigation of gradable adjectives,2013,10.1017/CBO9781139519328.014
2016,10-G1,5,Guasti,Maria Teresa,47,Clitics across linguistic modes and in a cross-linguistic perspective,2013,
2016,10-G1,5,Guasti,Maria Teresa,48,CLAD-ITA GAPS: un test di screening delle abilità fonologiche e morfo-sintattiche in bambini con un Disturbo Specifico del Linguaggio [Development of the CLAD-ITA GAPS: A screening test to assess morpho-syntactic and phonological abilities in children with specific language impairment],2013,10.1449/74826
2016,10-G1,5,Guasti,Maria Teresa,49,Agreement in the production of subject and object wh-questions,2013,
2016,10-G1,5,Guasti,Maria Teresa,50,Comparison of handwriting of Italian dyslexic children with or without dysgraphia,2013,
2016,10-G1,5,Guasti,Maria Teresa,51,The processing of wh-questions in Italian: evidence from an eye-tracking study.,2013,
2016,10-G1,5,Guasti,Maria Teresa,52,Production and Comprehension of Direct Object Clitics and Definite Articles By Italian Children With Developmental Dyslexia,2013,
2016,10-G1,5,Guasti,Maria Teresa,53,Oral skills deficit in children with Developmental Dyslexia,2013,
2016,10-G1,5,Guasti,Maria Teresa,54,Locality and interference in the formation of object questions: a grammar through processing view,2013,
2016,10-G1,5,Guasti,Maria Teresa,55,Locality,2013,
2016,10-G1,5,Guasti,Maria Teresa,56,The processing wh-questions in Italian: Evidence from an eye-tracking study,2013,
2016,10-G1,5,Guasti,Maria Teresa,57,Comorbidity between dyslexia and dysgraphia,2013,
2016,10-G1,5,Guasti,Maria Teresa,58,Acquisition of Syntax,2013,
2016,10-G1,5,Guasti,Maria Teresa,59,Characterizing The Morphosyntactic Processing Deficit And Its Relationship To Phonology In Developmental Dyslexia,2013,10.1016/j.neuropsychologia.2013.04.009
2016,10-G1,5,Guasti,Maria Teresa,60,Event Related Potentials reveal anomalous morphosyntactic processing in developmental dyslexia,2013,10.1017/S0142716412000185
2016,10-G1,5,Guasti,Maria Teresa,61,Crosslinguistic differences and similarities in the acquisition of relative clauses. Evidence from Greek and Italian,2012,10.1016/j.lingua.2012.02.001
2016,10-G1,5,Guasti,Maria Teresa,62,The processing wh-questions in Italian: Evidence from an eye-tracking study,2012,
2016,10-G1,5,Guasti,Maria Teresa,63,Wh-question in acquisition,2012,
2016,10-G1,5,Guasti,Maria Teresa,64,The acquisition of partitive clitics in Romance five-year-olds,2012,
2016,10-G1,5,Guasti,Maria Teresa,65,"Comorbidities between developmental dyslexia, Specific Language Impairment, Disgraphia and motor problems",2012,
2016,10-G1,5,Guasti,Maria Teresa,66,Scalar Implicatures in Child Language: Give Children a Chance,2012,10.1080/15475441.2011.626386
2016,10-G1,5,Guasti,Maria Teresa,67,Interference in the production of Italian subject and object wh-questions,2012,10.1017/S0142716411000324
2016,10-G1,5,Guasti,Maria Teresa,68,Morphological Information and Memory Resources in Children's Processing of Relative Clauses in German,2012,10.1080/15475441.2011.634691
2016,10-G1,5,Guasti,Maria Teresa,69,A developmental study of subject and object relative clauses in italian,2012,
2016,10-G1,5,Guasti,Maria Teresa,70,Linguistic disorders in dyslexia,2011,
2016,10-G1,5,Guasti,Maria Teresa,71,Disambiguating Information and Memory Resources in Children's Processing of Italian Relative Clauses,2011,10.1007/s10936-010-9160-0
2016,10-G1,5,Guasti,Maria Teresa,72,Una varietà molto speciale: la LISt (Lingua dei Segni Italiana tattile).,2011,
2016,10-G1,5,Guasti,Maria Teresa,73,Der Erstspracherwerb (The first language),2011,
2016,10-G1,5,Guasti,Maria Teresa,74,Language disorders in Developmental Dyslexia: Behavioral and electrophysiological studies,2011,
2016,10-G1,5,Guasti,Maria Teresa,75,Complex constructions in Dyslexia,2011,
2016,10-G1,5,Guasti,Maria Teresa,76,Syntactic movement in Italian SLI,2011,
2016,10-G1,5,Guasti,Maria Teresa,77,SLI children’s weakness in morphosyntax and pragmatics,2010,
2016,10-G1,5,Guasti,Maria Teresa,78,The role of agreement in the production of Italian subject and object wh-questions,2010,
2016,10-G1,5,Guasti,Maria Teresa,79,Grammatical Feature Dissimilarities Make Relative Clauses Easier: a Comprehension Study with Italian Children,2010,
2016,10-G1,5,Guasti,Maria Teresa,80,Early center based care and language development in the third year,2009,
2016,10-G1,5,Guasti,Maria Teresa,81,The acquisition of morphosyntax in Italian: A cross-sectional study,2009,10.1017/S0142716408090024
2016,10-G1,5,Guasti,Maria Teresa,82,Universal grammar approaches to language acquisition,2009,
2016,10-G1,5,Guasti,Maria Teresa,83,"Nouns, adjectives, and the acquisition of meaning: new evidence from Italian-acquiring children",2009,10.1080/15475440802347528
2016,10-G1,5,Guasti,Maria Teresa,84,Grammatical features in the comprehension of Italian Relative Clauses by children,2009,
2016,10-G1,5,Guasti,Maria Teresa,85,Number and case in the comprehension of relative clauses: Evidence from italian and greek,2008,
2016,10-G1,5,Guasti,Maria Teresa,86,Article Omission across Child Languages,2008,10.1080/10489220801937346
2016,10-G1,5,Guasti,Maria Teresa,87,Number and Case in the comprehension of relative clauses: Evidence from Italian and Greek,2008,
2016,10-G1,5,Guasti,Maria Teresa,88,Children's processing of subject and object relatives in Italian,2008,
2016,10-G1,5,Guasti,Maria Teresa,89,Children’s processing of subject and object relatives in Italian,2006,
2016,10-G1,5,Guasti,Maria Teresa,90,L'acquisizione del linguaggio. Un'introduzione,2006,
2016,10-G1,5,Guasti,Maria Teresa,91,Cross-Linguistic differences in Child and Adult Speech optional omission: A comparison of Dutch and Italian,2006,
2016,10-G1,5,Guasti,Maria Teresa,92,"A cross-sectional study on the use of ""be"" in early Italian",2006,
2016,10-G1,5,Guasti,Maria Teresa,93,Subject and object relative clauses in Italian: Normal subjects and an agrammatic patient,2006,10.1016/j.bandl.2006.06.091
2016,10-G1,5,Guasti,Maria Teresa,94,Children comprehension of sentences involving scalar items,2005,
2016,10-G1,5,Guasti,Maria Teresa,95,Analytic causatives,2005,
2016,10-G1,5,Guasti,Maria Teresa,96,Overt subject distribution in early Italian children,2005,
2016,10-G1,5,Guasti,Maria Teresa,97,Children failures with Scalar Implicatures: a reassessment of their pragmatic competence,2005,
2016,10-G1,5,Guasti,Maria Teresa,98,Why children and adults sometimes (but not always) compute implicatures,2005,10.1080/01690960444000250
2016,10-G1,5,Guasti,Maria Teresa,99,Determinazione del valore dei parametri attraverso la prosodia: l'ipotesi di boostrapping fonologico,2005,
2016,10-G1,5,Guasti,Maria Teresa,100,Scalar Implicatures in children: failures or skilful strategies?,2005,
2016,10-G1,5,Guasti,Maria Teresa,101,Semantic and Pragmatic Competence in Children's and Adults' Comprehension of Or,2004,
2016,10-G1,5,Guasti,Maria Teresa,102,What accounts for children non-adultlike linguistic behaviour?,2004,10.1017/S0305000904006105
2016,10-G1,5,Guasti,Maria Teresa,103,"The privilege of first position in agrammatism, child language acquisition and headlinese",2004,
2016,10-G1,5,Guasti,Maria Teresa,104,Scalar implicatures in child language: failures or skilful strategies?,2004,
2016,10-G1,5,Guasti,Maria Teresa,105,Article Omission: across Child Languages and across Special Registers,2004,
2016,10-G1,5,Guasti,Maria Teresa,106,Prosodic structure and syntactic acquisition: the case of the head-direction parameter,2003,10.1111/1467-7687.00273
2016,10-G1,5,Guasti,Maria Teresa,107,Relative clause formation in Romance child's production,2003,
2016,10-G1,5,Guasti,Maria Teresa,108,How parameters are set early and the order of setting,2003,
2016,10-G1,5,Guasti,Maria Teresa,109,Syntactic breakdown and recovery of clausal structure in agrammatism,2002,
2016,10-G1,5,Guasti,Maria Teresa,110,Focus-stress alignment and its consequences for acquisition,2002,10.1418/7558
2016,10-G1,5,Guasti,Maria Teresa,111,Omissioni e regolarità all’interno del sintagma nominale,2002,
2016,10-G1,5,Guasti,Maria Teresa,112,Agreement  and tense as distinctive syntactic positions. Evidence from acquisition,2002,
2016,10-G1,5,Guasti,Maria Teresa,113,Language Acquisition. The growth of grammar,2002,
2016,10-G1,5,Guasti,Maria Teresa,114,Romance causatives and dynamic antisymmetry,2001,
2016,10-G1,5,Guasti,Maria Teresa,115,Semantic Interfaces,2001,
2016,10-G1,5,Guasti,Maria Teresa,116,Comprehension of reversible active and passive sentences in agrammatism,2001,10.1080/02687040143000005
2016,10-G1,5,Guasti,Maria Teresa,117,"Agrammatism, syntactic theory and the lexicon: Broca's area and the development of linguistic ability in the human brain. Comment to ""The Neurology of Syntax: Language use without Broca's area"" by Yosef Grodzinsky",2000,
2016,10-G1,5,Guasti,Maria Teresa,118,Pre lexical setting of the head complement parameter through prosody,2000,
2016,10-G1,5,Guasti,Maria Teresa,119,An excursion into interrogatives in early English and Italian,2000,
2016,10-G1,5,Guasti,Maria Teresa,120,Backward versus forward anaphora: Reconstruction in child language,1999,
2016,10-G1,5,Guasti,Maria Teresa,121,Reflexions  on   prosodic bootstrapping: its role for lexical and syntactic acquisition,1997,
2016,10-G1,5,Guasti,Maria Teresa,122,Romance causatives,1997,
2016,10-G1,5,Guasti,Maria Teresa,123,Selecting word order: The rhythmic activation principle,1996,
2016,10-G1,5,Guasti,Maria Teresa,124,A Cross-Linguistic Study of Romance and Arbëresh Causatives,1996,
2016,10-G1,5,Guasti,Maria Teresa,125,On the controversial status of Romance interrogatives,1996,10.1515/prbs.1996.8.2.161
2016,10-G1,5,Guasti,Maria Teresa,126,Acquisition of Italian interrogatives,1996,
2016,10-G1,5,Guasti,Maria Teresa,127,Semantic Restrictions in Romance Causatives and the Incorporation Approach,1996,
2016,10-G1,5,Guasti,Maria Teresa,128,Small clauses,1995,
2016,10-G1,5,Guasti,Maria Teresa,129,The acquisition of French relative clauses revisited,1995,10.1207/s15327817la0404_1
2016,10-G1,5,Guasti,Maria Teresa,130,Verb Syntax in Italian Child Grammar. Finite and Nonfinite verbs,1993,10.1207/s15327817la0301_1
2016,10-G1,5,Guasti,Maria Teresa,131,Negation in epistemic small clauses,1993,10.1515/prbs.1993.5.1-2.39
2016,10-G1,5,Guasti,Maria Teresa,132,Causative and Perception Verbs. A Comparative Study,1993,
2016,10-G1,5,Guasti,Maria Teresa,133,La forme logique des phrases adverbiales et la nature des événements,1992,
2016,10-G1,5,Guasti,Maria Teresa,134,"Incorporation, Excorporation and Lexical Properties of Causatives Heads",1991,10.1515/tlir.1991.8.2-4.209
2016,10-G1,5,Guasti,Maria Teresa,135,Analizzatori del linguaggio naturale basati su grammatiche,1991,
2016,10-G1,5,Guasti,Maria Teresa,136,"La Pseudorelative et les phénomènes d'accord. Une étude comparée du français, de l'italien et de l'anglais",1988,
2016,13-D4,1,Pellizzari,Paolo,1,Unemployment expectations in an agent-based model with education,2018,10.1007/978-3-319-94580-4_14
2016,13-D4,1,Pellizzari,Paolo,2,Generating unemployment expectations of the “man in the street”,2018,10.1007/978-3-319-94580-4_26
2016,13-D4,1,Pellizzari,Paolo,3,A computational model of labor market participation with health shocks and bounded rationality,2018,10.1007/s10115-017-1096-3
2016,13-D4,1,Pellizzari,Paolo,4,Dynamic patterns in similarity-based cooperation: an agent-based investigation,2017,10.1007/s11403-015-0155-7
2016,13-D4,1,Pellizzari,Paolo,5,Optimality of a Two-Tier Rate Structure for a Transaction Tax in an Artificial Market,2017,10.1007/978-3-319-60285-1_8
2016,13-D4,1,Pellizzari,Paolo,6,A replication of Pindyck’s willingness to pay: on the sacrifice needed to obtain results,2017,10.2139/ssrn.3065870
2016,13-D4,1,Pellizzari,Paolo,7,Molteplicità nell'idea di Università,2016,
2016,13-D4,1,Pellizzari,Paolo,8,An Agent-Based Model of Labor Market Participation with Health Shocks,2016,10.1007/978-3-319-39324-7_14
2016,13-D4,1,Pellizzari,Paolo,9,Trade-In Programs in the Context of Technological Innovation with Herding,2015,10.1007/978-3-319-09578-3_18
2016,13-D4,1,Pellizzari,Paolo,10,Clinical and biochemical determinants of the extent of liver steatosis in type 2 diabetes mellitus,2015,10.1097/MEG.0000000000000462
2016,13-D4,1,Pellizzari,Paolo,11,In whose best interest? An agent-based model of high frequency trading,2015,10.1007/978-3-319-19629-9_2
2016,13-D4,1,Pellizzari,Paolo,12,Simulation in management accounting and management control: editorial,2015,10.1007/s00187-015-0215-0
2016,13-D4,1,Pellizzari,Paolo,13,OPTIMAL POLICIES IN TWO-STEP BINARY GAMES UNDER SOCIAL PRESSURE AND LIMITED RESOURCES,2015,10.1142/S0219525915500204
2016,13-D4,1,Pellizzari,Paolo,14,Performance implications of active management of institutional mutual funds,2015,10.1111/acfi.12056
2016,13-D4,1,Pellizzari,Paolo,15,The Simplicity of Optimal Trading in Order Book Markets,2014,10.1007/978-3-319-07470-2_11
2016,13-D4,1,Pellizzari,Paolo,16,Citizenship and power in an agent-based model of tax compliance with public expenditure,2014,10.1016/j.joep.2012.12.006
2016,13-D4,1,Pellizzari,Paolo,17,Tax Enforcement in an Agent-Based Model with Endogenous Audits,2014,10.1007/978-3-319-00912-4_4
2016,13-D4,1,Pellizzari,Paolo,18,Convergence of outcomes and evolution of strategic behavior in double auctions,2013,10.1007/s00191-011-0226-4
2016,13-D4,1,Pellizzari,Paolo,19,Does sharing values lead to cooperation? A similarity-based investigation,2012,10.2139/ssrn.2037349
2016,13-D4,1,Pellizzari,Paolo,20,Facebook come piattaforma d’apprendimento per la matematica,2012,10.978.88905406/77
2016,13-D4,1,Pellizzari,Paolo,21,Citizenship and Power in an Agent-based Model of Tax Compliance with Public Expenditure,2012,
2016,13-D4,1,Pellizzari,Paolo,22,Sense making and information in an agent-based model of cooperation,2012,10.1007/978-3-642-31301-1_11
2016,13-D4,1,Pellizzari,Paolo,23,A Dynamic Analysis of the Microstructure of Moving Average Rules in a Double Auction Market,2012,10.1017/S136510051000074X
2016,13-D4,1,Pellizzari,Paolo,24,No association between the degree of liver steatosis and early signs of vasculopathy in T2DM,2012,10.1016/j.numecd.2011.11.008
2016,13-D4,1,Pellizzari,Paolo,25,The impact on the pricing process of costly active management and performance chasing clients,2011,10.1007/s11403-010-0076-4
2016,13-D4,1,Pellizzari,Paolo,26,A Multi-Agent Model of Tax Evasion with Public Expenditure,2011,
2016,13-D4,1,Pellizzari,Paolo,27,Optimal trading in a limit order book using linear strategies,2011,
2016,13-D4,1,Pellizzari,Paolo,28,Time-dependent trading strategies in a continuous double auction,2011,10.1007/978-3-642-21108-9_14
2016,13-D4,1,Pellizzari,Paolo,29,Allocative efficiency and traders' protection under zero intelligence behavior,2011,10.1007/978-3-642-16943-4
2016,13-D4,1,Pellizzari,Paolo,30,Progress in Artificial Economics,2010,
2016,13-D4,1,Pellizzari,Paolo,31,Mutual funds flows and the 'Sheriff of Nottingham' effect,2009,10.1007/978-3-642-02956-1_10
2016,13-D4,1,Pellizzari,Paolo,32,A Dynamic Analysis of the Microstructure of Moving Average Rules in a Double Auction Market,2009,
2016,13-D4,1,Pellizzari,Paolo,33,Some effects of transaction taxes under different microstructures,2009,
2016,13-D4,1,Pellizzari,Paolo,34,Some effects of transaction taxes under different microstructures,2009,10.1016/j.jebo.2009.08.010
2016,13-D4,1,Pellizzari,Paolo,35,The Impact on the Pricing Process of Costly Active Management and Performance Chasing Clients,2009,
2016,13-D4,1,Pellizzari,Paolo,36,Coopetition and complementarities: modelling coopetition strategy and its risks at an individual partner level,2008,10.2753/JMR1536-5433060303
2016,13-D4,1,Pellizzari,Paolo,37,Zero-intelligence trading without resampling,2008,10.1007/978-3-540-70556-7_1
2016,13-D4,1,Pellizzari,Paolo,38,Learning and equilibrium selection in a coordination game with heterogeneous agents,2007,10.1016/j.physa.2007.02.073
2016,13-D4,1,Pellizzari,Paolo,39,A comparison of different trading protocols in an agent-based market,2007,10.1007/s11403-006-0016-5
2016,13-D4,1,Pellizzari,Paolo,40,Simple Market Protocols for Efficient Risk Sharing,2007,10.1016/j.jedc.2006.12.007
2016,13-D4,1,Pellizzari,Paolo,41,Which market protocols facilitate fair trading?,2007,10.1007/978-3-540-73135-1_6
2016,13-D4,1,Pellizzari,Paolo,42,Learning and equilibrium selection  in a coordination game with heterogeneous agents,2006,
2016,13-D4,1,Pellizzari,Paolo,43,Breeds of risk-adjusted fundamentalist strategies in an order-driven market,2006,10.1016/j.physa.2005.06.039
2016,13-D4,1,Pellizzari,Paolo,44,The allocative effectiveness of market protocols under intelligent trading,2006,10.1007/3-540-37249-0_2
2016,13-D4,1,Pellizzari,Paolo,45,Hierarchical clustering by means of model grouping,2006,10.1007/3-540-31314-1_29
2016,13-D4,1,Pellizzari,Paolo,46,Complexities and simplicity: a review of agent-based artificial markets,2005,
2016,13-D4,1,Pellizzari,Paolo,47,Static Hedging of Multivariate Derivatives by Simulation,2005,10.1016/j.ejor.2004.02.014
2016,13-D4,1,Pellizzari,Paolo,48,Cointegrazione dinamica tra serie storiche economiche,2005,
2016,13-D4,1,Pellizzari,Paolo,49,Nonparametric Monte Carlo Pricing of American Options,2004,
2016,13-D4,1,Pellizzari,Paolo,50,Pension schemes with a minimum guarantee: the pricing in the case of two underlying variables and stochastic interest rate,2004,
2016,13-D4,1,Pellizzari,Paolo,51,On the coincidence of system optimum and user equilibrium for a widely used family of cost functions,2004,
2016,13-D4,1,Pellizzari,Paolo,52,Breeds of risk-adjusted fundamentalist strategies in an order-driven market,2003,
2016,13-D4,1,Pellizzari,Paolo,53,Fundamentalists clashing over the book: A study of order-driven stock markets,2003,10.1088/1469-7688/3/6/306
2016,13-D4,1,Pellizzari,Paolo,54,Monte Carlo Pricing of American Options Using Nonparametric Regression,2002,
2016,13-D4,1,Pellizzari,Paolo,55,Utility based pricing of contingent claims in incomplete markets,2002,10.1080/1350486021000029255
2016,13-D4,1,Pellizzari,Paolo,56,Efficient Monte Carlo pricing of European options using mean value control variates,2001,10.1007/s102030170002
2016,13-D4,1,Pellizzari,Paolo,57,Approximate vs exact algorithms to solve the maximum line length problem,2001,10.1080/02331930108844548
2016,13-D4,1,Pellizzari,Paolo,58,Efficient Monte Carlo pricing of portfolio options,2000,
2016,13-D4,1,Pellizzari,Paolo,59,Time series filtering and reconstruction using fuzzy weighted local regression,1999,
2016,13-D4,1,Pellizzari,Paolo,60,Outliers Detection in Time series.,1998,
2016,13-D4,1,Pellizzari,Paolo,61,Adaptive local linear models for financial time series,1998,
2016,13-D4,1,Pellizzari,Paolo,62,The maximum line length problem: theory and numerical solutions,1997,
2016,13-D4,1,Pellizzari,Paolo,63,Fuzzy Weighted Local Approximation for Financial Time Series Modeling and Forecasting,1997,
2016,13-D4,1,Pellizzari,Paolo,64,Linear Local Approximation for Financial Time Series Forecasting.,1996,
2016,13-D4,1,Pellizzari,Paolo,65,RBF networks for financial data analysis and forecasting: a fuzzy-cluster approach,1996,
2016,13-D4,2,Graziano,Maria Gabriella,1,Coalitional fairness with participation rates,2018,10.1007/s00712-017-0543-7
2016,13-D4,2,Graziano,Maria Gabriella,2,Housing market models with consumption externalities,2018,
2016,13-D4,2,Graziano,Maria Gabriella,3,Cones with semi-interior points and equilibrium,2017,10.1016/j.jmateco.2017.03.002
2016,13-D4,2,Graziano,Maria Gabriella,4,Stable sets for exchange economies with interdependent preferences,2017,10.1016/j.jebo.2017.05.017
2016,13-D4,2,Graziano,Maria Gabriella,5,Oligopoly and cost sharing in economies with public goods,2016,10.1111/iere.12165
2016,13-D4,2,Graziano,Maria Gabriella,6,Stable Sets for Exchange Economies with Interdependent Preferences,2016,
2016,13-D4,2,Graziano,Maria Gabriella,7,On Vind’s theorem for an economy with atoms and infinitely many commodities,2015,10.1016/j.jmateco.2014.11.005
